deployment,organization,sector,m_L1,m_L2,m_L3,m_L4,evidence_L1,evidence_L2,evidence_L3,evidence_L4,url_L1,url_L2,url_L3,url_L4
GOV.UK Chat,UK Government Digital Service (GDS),Public Sector,0.25,0.0,0.25,0.25,Two layers of safety guardrails; scope-limited to GOV.UK content (least-privilege); clarifying follow-up questions on low-confidence queries (uncertainty-aware). Multiple guardrail classes on a single production agent.,no public evidence (single-agent service; no multi-agent population/emergence mechanisms),"Dedicated oversight/monitoring during pilots; red-teaming with the AI Security Institute (508 jailbreak attempts, all blocked) reflects oversight and human governance (partial L3).",Staged/progressive rollout across two public pilots; measured accuracy improvement 76% to 90% with gaps tracked; latency monitored; safety evals as gating. Several ops classes (partial).,https://www.gov.uk/government/news/governments-experimental-ai-chatbot-to-help-people-set-up-small-businesses-and-find-support,,https://insidegovuk.blog.gov.uk/2026/05/15/developing-gov-uk-chat-our-data-science-and-ai-engineering-journey/,https://www.publictechnology.net/2026/03/19/science-technology-and-research/gds-reports-achieving-90-accuracy-in-gov-uk-chat-pilots/
Alaska Inspires (AI Destination Search),Alaska Airlines (with Microsoft Azure OpenAI),Retail / Airline,0.25,0.0,0.0,0.25,"Natural-language destination search built on Azure OpenAI with explicit hallucination mitigation and grounding to accurate pricing/destination data (anti-hallucination guardrails, scoped data). Partial guardrail classes.",no public evidence,no public evidence (read-only discovery/search tool with no documented human escalation or override mechanism),"Measured outcomes since June 2024 launch: 7% conversion (vs 5% baseline), 90% guest satisfaction, 87% repeat intent; iterative model fine-tuning. Golden-signal/observability partial.",https://www.microsoft.com/en/customers/story/25850-alaska-airlines-azure-openai,,,https://www.customerexperiencedive.com/news/alaska-airlines-natural-language-search-trip-planning/807705/
Verdi Customer-Service Mediation,Mercado Libre (with OpenAI),Retail / E-commerce,0.25,0.0,0.25,0.25,"Verdi platform provides a structured framework governing GPT-4o-based agents and scoped API access for handling buyer-seller dispute mediation (bounded tool use, partial guardrails).",no public evidence,"Agent interfaces with internal employees when necessary during mediation, handing off complex cases to humans (escalation, partial L3).","Structured developer platform (17k devs, 30k microservices) with measured scope of automation (~10% of customer-service mediation on a major site). Platform/observability partial.",https://openai.com/index/mercado-libre/,,https://openai.com/index/mercado-libre/,https://openai.com/index/mercado-libre/
Sparky Shopping Assistant,Walmart,Retail / E-commerce,0.25,0.0,0.0,0.25,"Transactions constrained to Walmart's own checkout with scoped access to real-time inventory/pricing/delivery data (least-privilege tool access); deliberately deployed for narrow, specific tasks. Partial guardrail classes.",no public evidence,no public evidence (no documented human escalation/override in the shopping-assistant flow),Adoption and business metrics tracked (~half of app users tried it; ~35% higher average order value for users); phased task-specific rollout. Golden-signal/observability partial.,https://corporate.walmart.com/news/2025/06/06/walmart-the-future-of-shopping-is-agentic-meet-sparky,,,https://talkbusiness.net/2026/07/the-supply-side-walmarts-sparky-shopping-agent-drives-more-sales/
Agentforce (Einstein Trust Layer),Salesforce,SaaS / CRM,0.25,0.0,0.25,0.25,"Einstein Trust Layer sits between every prompt and the LLM: topic/scope guardrails, data masking, toxicity detection on outputs, and permission-based access controls (least-privilege). Multiple L1 classes on production agents; coverage unmeasured publicly.",no public evidence,Each LLM call is its own immutable audit record (audit trail is the source of truth for what the model saw); human review recommended before actions (approval gate). ~2-3/9 classes; no drill/SLA metrics.,Agentforce Testing Center simulates and scores agent behavior before deployment (pre-prod evals); audit records analyzed in Data 360 (observability). Partial L4; no CI-gate/coverage metrics published.,https://www.salesforce.com/welcome-to-the-agentic-enterprise/ai-guardrails/,,https://www.salesforce.com/blog/best-practices-for-secure-agentforce-implementation-2/,https://trailhead.salesforce.com/content/learn/modules/trusted-agentic-ai/explore-agentforce-guardrails-and-trust-patterns
Joule agents / AI Agent Hub,SAP,SaaS / ERP,0.25,0.0,0.25,0.25,"Joule Studio ships built-in operational controls: guardrails plus human checkpoints, and scoping of what each agent 'is allowed to touch' (least-privilege). Partial L1; coverage unmeasured. Some claims sourced to partner/analyst blogs (flagged as indirect).","no public evidence (Agent Hub is a registry, not an interaction-graph/cascade monitor)","AI Agent Hub is a central registry showing what each agent does, is allowed to touch, and actually did (provenance/audit) and monitors every agent (oversight meta-monitoring); human oversight by default for critical decisions (approval gates). ~3/9 classes.","Process Insights for behavioral observability/impact analysis (semantic observability); managed runtime embedding operations/controls; evaluation built in. Partial L4; described as platform capability, coverage not measured.",https://community.sap.com/t5/artificial-intelligence-blogs-posts/agent-builder-in-joule-studio-is-now-generally-available-build-your-own/ba-p/14289282,,https://ignitesap.com/sap-ai-agent-hub-and-agent-governance/,https://www.ux4tech.com/blog/sap-ai-agent-hub-enterprise-governance
Rovo agents (Jira/Confluence),Atlassian,SaaS / collaboration,0.25,0.0,0.25,0.25,"Agents inherit the triggering user's existing permissions and can only touch what that user can (least-privilege tool access); tenant isolation and zero-retention inference. Mainly permission-scoping; ~1-2/9 classes, unmeasured.",no public evidence,Approved agent updates captured alongside human work-item history (audit/provenance); agents operate inside Jira approval workflows (approval gates); admin governance/oversight config. ~2/9 classes.,"Admin governance controls, auditability (who accessed what/when/why), and consistent policy across production and sandbox environments. Thin public semantic-observability evidence; ~1-2/10 classes.",https://support.atlassian.com/rovo/docs/rovo-agent-permissions-and-governance/,,https://techinformed.com/atlassian-adds-ai-agents-to-jira-under-existing-permissions/,https://support.atlassian.com/rovo/docs/rovo-agent-permissions-and-governance/
AI Companion / Virtual Agent,Zoom,SaaS / communications,0.25,0.0,0.25,0.25,"Layered safeguards: real-time safety checks, multi-model cross-checking to validate responses (closed-loop guardrails), hallucination prevention, and answers drawn only from customer-approved sources (least-privilege data). Partial L1; coverage unmeasured.","no public evidence (multi-model cross-check is output validation, not population-level model-diversity governance)",Vertical-specific backend logic to prevent off-policy responses and escalation paths to human agents; post-call analytics provide a review record. ~1-2/9 classes; no measured SLA.,Enterprise observability via AI simulations and post-call analytics (evals + semantic observability). Partial L4; measured coverage not published.,https://www.zoom.com/en/products/virtual-agent/features/responsible-ai/,,https://www.zoom.com/en/products/virtual-agent/features/responsible-ai/,https://www.zoom.com/en/products/ai-assistant/resources/privacy-security/
Fin AI customer-service agent,Intercom,SaaS / customer support,0.25,0.0,0.25,0.25,"Fin AI Engine runs pre-answer safety checks: confidence threshold (uncertainty-aware), accuracy and grounding checks before responding (closed-loop guardrail); answers only from approved content sources. Partial L1; coverage unmeasured.",no public evidence,"Configurable escalation to humans on triggers (customer requests human, appears angry, stuck in a repetitive loop) = behavioral/algedonic escalation and iteration-limit fallback. ~2/9 classes; no measured escalation latency published.","Full observability suite plus documented Honeycomb case study on distributed tracing to observe/operate Fin in production (semantic observability, golden signals); changes testable before going live. Partial L4.",https://www.intercom.com/help/en/articles/9929230-the-fin-ai-engine,,https://www.intercom.com/help/en/articles/10210126-provide-fin-ai-agent-with-specific-guidance,https://www.honeycomb.io/resources/case-studies/how-honeycomb-helped-intercom-observe-and-operate-fin-ai
Sidekick merchant agent,Shopify,SaaS / e-commerce,0.25,0.0,0.0,0.25,Cheap deterministic validation checks run before the expensive LLM judge (basic-layer validation / closed-loop guardrail); anti-reward-hacking safeguards on outputs. ~1-2/9 classes; coverage unmeasured.,"no public evidence (merchant simulation is user simulation for eval, not agent-population simulation)","no public evidence of tiered autonomy, approval gates, kill switch, or audit-trail supervisory controls in the engineering account","Rigorous eval framework: LLM-as-judge + merchant simulation, ground-truth sets sampled from production and continuously grown, with judge-vs-human agreement measured statistically (evals + measured effectiveness, golden signals). Strong on the eval axis but only ~3/10 L4 classes, so held at 0.25.",https://shopify.engineering/building-production-ready-agentic-systems,,,https://shopify.engineering/building-production-ready-agentic-systems
AI Agents governed via AI Control Tower,ServiceNow,SaaS / enterprise workflow,0.25,0.0,0.25,0.25,"Runtime agent-deviation detection flags straying from authorized role, prompt-injection and override attempts (circuit-breaker-like); deterministic output screening for PII/XSS/SQLi/RCE (closed-loop guardrail). ~2-3/9 classes; coverage unmeasured.",no public evidence of population/interaction-graph monitoring (deviation detection is per-agent),AI Control Tower is a fleet oversight/meta-monitoring plane (discover/observe/govern/measure) with Intelligent Approvals (approval gates) and audit. ~3/9 classes; certification/SLA not published.,"Traceloop-based deep runtime observability into agent reasoning/decisions (semantic observability), plus govern/secure/measure enforcement (policy gates). Partial L4; measured error-budget coupling not shown.",https://newsroom.servicenow.com/press-releases/details/2026/ServiceNow-expands-AI-Control-Tower-to-discover-observe-govern-secure-and-measure-AI-deployed-across-any-system-in-the-enterprise/default.aspx,,https://www.servicenow.com/products/ai-control-tower.html,https://www.servicenow.com/products/ai-control-tower.html
IntentCX,T-Mobile (with OpenAI),Telecom,0.25,0.0,0.25,0.0,"Intent-driven decisioning platform with secure/scoped access to T-Mobile data (least-privilege); autonomous customer interactions only 'under certain circumstances' (bounded autonomy). Announcement/testing-stage signal, 2025 rollout.",no public evidence,"Primary mode is agent-assist: platform delivers individualized solutions that human contact-center agents use, with human-in-the-loop for complex cases (tiered autonomy, partial).",no public evidence (deployment still in testing; no ops/eval/rollout mechanisms documented),https://www.t-mobile.com/news/business/t-mobile-launches-intentcx-with-openai,,https://www.customerexperiencedive.com/news/t-mobile-openai-customer-service-agents-generative-ai-intentcx/727572/,
